{
  "$schema": "https://raw.githubusercontent.com/riehlegroup/msadoc/main/schemas/service-doc.json",

  "name": "SchedulerService",
  "group": "backend.etl.extract",
  "tags": ["project=msadoc-demo"],

  "repository": "https://github.com/msadoc-demo/scheduler-service",
  "taskBoard": "https://github.com/orgs/msadoc-demo/projects/3",
  "developmentDocumentation":
    "https://github.com/msadoc-demo/scheduler-service/blob/main/README.md",
  "deploymentDocumentation":
    "https://github.com/msadoc-demo/scheduler-service/blob/main/deployment.md",
  
  "responsibles": ["jane.smith@msadoc-demo.org"],
  "responsibleTeam": "ET Team",
  
  "extensions": {
    "usedInProducts": ["WhileLabelProduct", "CloudService"],
    "programmingLanguage": "TypeScript"
  },

  "providedAPIs": ["/scheduler/tasks"],
  "subscribedEvents": [
    "extraction.config.created",
    "extraction.config.updated",
    "extraction.config.deleted"
  ],
  "publishedEvents": ["extraction.execution.triggered"]
}
