{
  "$schema": "https://raw.githubusercontent.com/riehlegroup/msadoc/main/schemas/service-doc.json",
  "name": "ExtractionService",
  "group": "backend.etl.extract",
  "tags": ["project=msadoc-demo"],
  "repository": "https://github.com/msadoc-demo/extraction-service",
  "taskBoard": "https://github.com/orgs/msadoc-demo/projects/2",
  "deploymentDocumentation": "https://github.com/msadoc-demo/extraction-service/blob/main/deployment.md",
  "responsibles": ["jane.smith@msadoc-demo.org"],
  "responsibleTeam": "ET Team",
  "extensions": {
    "usedInProducts": ["WhiteLabelProduct", "CloudService"],
    "programmingLanguage": "TypeScript"
  },
  "providedAPIs": ["/extractions/config", "/extractions/execution-stats"],
  "subscribedEvents": ["extraction.execution.triggered"],
  "publishedEvents": [
    "extraction.config.created",
    "extraction.config.updated",
    "extraction.config.deleted",
    "extraction.execution.success",
    "extraction.execution.failure"
  ]
}
